,id,title,transcript
327,IIDdA2wNCFA,가훈을 뭐라고 생각하세요?,혜암 읽어주세요 이것을 c 를 만들었어요 에 호밍 선지선 일수 자를 캐 가지고 비쳤다 죠스가 분이 다이오드 이제 우리가 운이 고 2고 모델 구매 는 이제 저 초현대식 맞아야 되고 부디 카운트 d 어제 바뀌네요 2g 법원에 절 전이었는데 이걸 형이 이정도 노력은 야드 2 물에 까사 로 써서 노래를 1 전체 리움 까 발간은 맞춰가며 사나요 눈이 소외 범인을 넌 죽어 사람이 빅뱅의 죽어 아 아스터
328,9Rt1-pmtsb4,저는 무식하게 안 합니다,어 그래 쉽게 떠 5 5 내 순서 아 아 아 쉬울까요 요리가 또 멈 긴 맡기고 아 빠 좀 먹어 싸 없이 5 맛있잖아 갑자 그러한 요번에 사랑 에 써 흘러 3 저는 정확하게 합니다 그리고 최악이 아닌 것 같아 착각 아까 얘기했잖아 틱톡 t 했었죠 그러니까 아 예 어 차피 없을 세냐 얻을 수 없어
329,U0i1y20FM6w,날로 먹기 위한 노력,자꾸 저한테 날 못 한다고 하시는데 날 먹 카 려고 연구 또 연구 고민한 노력은 왜 안 알아주는 거야 날 뭐 카 기에서 하는 연구 고민 보내 거기다 드리는 수많은 나라의 들 시간 어떻게 해야 이 시스템을 구축해야 내가 날 못 할 수 있을까 38년간 그것도 인정 받으실 때는 나도 어쩌면 노력하는 사람 일지도 이런 거죠 뭐 예를 들면 뭐 신발 만드는 기계를 개발해 써요 그 기계가 계속 만 들어도 귀에 만든 사람한테 너는 왜 일 안에 왜 날로 먹어 아니죠 그 기계를 만들었죠
330,aCUXaSc9UCc,공중급유,그리핀 탄 들어오세요 이것도 빨리 바꿔 타면 기분 진짜 좋거든 힘이 친척들 댄스 이러다가 진짜 1 2 3 얼라 얘 아 오 어 또 합칠 ppb 비밀 고 있음을 둘입니다 야 이것 그래서 막 도착해서 갑자기 알라는 거 아냐 내 아이 하지만 떼어내어 빨리 0 빨리 때 딴 테 8 떼어내어 요 아 우리 의심하게 써 사람들이 아빠 얼 쉿 그래 아아 어디에 사람도 있는데 아 쭉 편집장 나는 특별 던진다는 쿠폰을 받아 비싼거
331,mIb2zkBJRTI,억까 인형뽑기,고객님 늦은 시간에 인연법 은우 절대 소리 지르지 마라 주세요 한판에 볼까요 자 갑니다 못 볼까요 여기 빨간색 파란색 거의 넘어와서 빨간색 여기 예 예 야자 2 이태 가리 집어 가지고 계속 끌고 가자 근데 이 거에요 이렇게 돼 있죠 어 이렇게 되있으면 안되는데 5 뭐 어 어 대가리 옆으로 업그레 그래 그래 찝어 아아 왜 이러니까 소리지르지 어떻하죠 앞으로 들어왔어요 테 허리가 옆으로 염 옆으로 해서 이렇게 집은 다면 이렇게 가기 으 으 뭐 수 들고 우울해 1000원 버렸잖아 그냥 지역사회 환원 했다고 생각했습니다
332,BQJErHijjKs,무리 무리 무리 데스,후 그리고 아 무리 무리 무리 데스 무리무리 뿌리다 싸 무리무리 아무리 되죠 그니까 이게 사실 자 한국에도 있는 한 잔 데 무리하다 이게 일상생활에서 뭐 했을 때 얻어 물이 했는데 의 정도는 쓰겠지만 아 무리 우리 아무리 뭐 이렇게 해야지 않잖아 이것도 한국 스러운 거야 뭐 어떻게 해야돼 알게 해야 돼 아무리 아 아 으 아 아 따 이렇게 밖에 없다 파다 꺼려 야 이제 보니까 어 이렇게 하는거구나 이렇게 아 아무리 물이 아무리 아무리 대물이 데스 후기 됐어요 5
333,QjuJ86z3cnA,차갑게 행동하는 법,자 이거 한거 보겠습니다 차가 게임 동안 버 미소를 짓지마 차가 보고 싶다면 얼마전 믿을 있지만 5차 무차 마세요 여기서 안녕 아냐 미소를 보이며 이희진 하는 줄 알아요 이렇게 찌푸리고 미소로 보지마 절대 었지만 끌어 안 해 드려 보아요 아니 악수 마 이거 인상을 찌푸리고 오슬로 멀 웃을 락 말락 노안 하지마 미술 및 싣지 마 누가 짱가 들은 안드로 만저 경직 바로 형지 아톤 도 일정하게 말을 할 때 목소리를 격하게 높이거나 줄이지 마세요 차갑고 차분한 일정한 톤을 유지하세요 이렇게 물이 하냐고 하면 무슨 뜻인지 모르겠다고요 그거 무슨 뜻이죠 이렇게 그걸 힘드시죠 야 너 오늘 뭐 이렇게 표준 게 안 좋아 그것은 있으신데 건드려 경직 딴 대봐 절대 얻자 나
334,r8mIk9acQ_k,이거 못 맞혀요?,유명한 게임이 한번 키워요 예 [음악] 그리고 마치 충분히 마실 수 있는데 집단 지상으로 맞췄어요 잘 알려주셔서 빛과 피터 피카츄 이거를 침 창 맨 의 어떤 발음으로 변형을 시켜 보세요 삐까 삐까 삐까 줘 [음악] 아이고 왜 분 많죠 아 야 이건 뭐 마차나 예 예 이찌 왜 못 맞추어 아 이거 뭐 자 이건 어쩔수 없고 [음악] 신타 드리겠습니다 피카츄 의 발음 나는 대로 입니다 피카츄의 변형 피카츄의 어떤 언어 uc 진짜 허용 시적 어요 믿게 찌기 입니다 이렇게 아 아 아 피트를 있겠지요 이거 맞죠
335,B2VW6S2_Zys,든든하고 낭낭한 바지,이번에 침착한 주말 찍을 때 카메라 감독님이 편해 보이는 바지가 있어서 그걸 입기로 했거든요 배기 팬츠래요 와 이거 뭐야 미친 침착맨 전용 팬츠 아니야 허벅지는 개 넓고 이거는 그냥 침착맨 다리에다 색칠해 놓은 거 같은데 그러면 이렇게 검색하죠 고추 부분 넉넉한 고추 넉넉 팬츠라고 한번 쳐보지 낭심 든든 조각팬츠 낭심 든든 조합팬츠 낭심낭낭
336,VYrL-9-t9KM,행보관님 왜 그러시는 건가요...?,각종 막 제 구들이 들어오고 있어 행복한 지금의 진짜 왜 그렇게 집합을 자주 시키나요 같은 생각나는데 부드 원산 이미 팝스타 어셔 야 되면 괜히 있어서 없이 어셔 라고 왼쪽을 없음에 따라 색감에 미쳤어 있네요 행복하니 왜 있고 주말 오후 2시 이불 터는 것 같아요 걔들도 좋겠습니까 그러면 사서 용어를 또 이렇게 한번 상기시켜 줘요 개인 정비 씹에 아니라 너무들 게 아니고 말그대로 개인 정비 의자 1 사랑하시는 많이 쓰니 뱅크와 는 기본만 지키면 너희들 쉬는것도 창해 진짜 길이 폭 싸돌아 이제 제법 에게는 엄청 높아 아 그리고 꼭 그 털로 다 같은 뒤에 재밌는걸 티비에서 진짜 열받는 건 자랑 탕평 해가지고 매트리스 이렇게 셈으로 내 아직 다 세워 가지고 올리는데 올릴때 없으니까 금이다 또 걸리고 얘야 또 울어요 여기서 일반 봐줘야 모음
337,nVhZ3UBP8wg,물리엔진 오류 3인방,그 저는 제 몸 전체를 볼 이거 게 없잖아요 근데 말이야 네 건강하게 나 이런걸 찍으면서 제 몸이 졸라 웃기게 움직인다는 걸 알았어 이봉걸 미묘한 이 사람이 있어 기계음 프레임 드랍이 있어 7차 베는 프레임이 너무 높아요 아 저도 움직임은 기교 라고 얘기하고 그리고 귀한 은 걔는 물리의 인지 약간 고장난 거 있잖아 위 일어나는게 있어 가끔 마 고양이들이 않아서 들 으 가 전자 브라이언 박과 my 걸렸어 5 카드의 멋 좀 어찌 뭐 이상한 게 있어 뭐 이런 매의 눈 을 있겠구나 나는 여기 패에서 이 골반 얘기에 꺾여 가지고 3채널 나누시고 하체만 말이야 잘 실패 사이 나는 모델링하는 모델 어가 뼈 더 이상하게 심은 어 말라 가져 캐릭터 혀 브랜드라 딛고 케어 피부 때 어려워
338,UHnb96P_s2o,귀찮음이 육체를 지배한 사나이,600 와셔 단 시켰다고 요 내용물이 잘못 탔네 어떻게 된 거야 저 주문을 했는데요 깔아 악의 오물을 시켰는데 근데 알도 비프 샤부 카레 이게 왔네요 전화번호는 요 잠시만요 아예 제가 알고 싶은건 그냥 먹어도 되나 있어요 그냥 먹게 해주면 안될까요 1 죄송 하실 그 안채는 죄송 하실 필요 없어요 그 알아보시면 죄송한 거에요 그냥 먹어도 될까요 그 말씀만 해주시면 되요 허락 하신 거죠 먹어도 됩니다 초 아야 알겠습니다 좋은하루 보내십시오 예 감사합니다 공포 키 귀찮음이 육체를 지배한 1 그렇죠 여러분 들쳐 먹어도 되죠
339,0HoaNy0guOo,형...,뭐 이렇게 썼어요 음압이 크리 먹어야죠 아 손으로 뭐 거야 아니 여기 샤드 가슴 10초당 소금이 들어 있어서 다소 독이 돼 기업회생 널리 네발로 준 올려 같은데 그만 그 나물에 그 밥이라고 하지 마세요 아니 배추 저는 부산에 봤는데요 너무 웃겼어 4월 하고 나왔어요 무통 헐벗고 있었어 귀한 8 4 한테 영상통화가 국제 걸려온 거에요 귀한 8 4 두통을 더 뚝 덮고 있어서 오우 해서 이제 탬파 사가다 오고 이제 뭐 귀퉁이에 이제 제가 나오잖아요 둘다 다벗고 있는 거야 그리고 안 끊어 이건 외로 없나봐 그래서 제가 아 그래 너도 건강하고 개조하는 데 0 시간 없어 그냥 어깨 조 이어가는 거에요 그래서 제가 하며 한 두 번인가 다시 시도에서 그래 건강하고 화이팅 이렇게 하니까 어 나랑 추천 해주실분 아 고민 좀 바꿔봐 그래서 보냈더니 5초도 안 똑 바로 나한테 갖다 줘
340,5uefb4OJPt0,현대 인류의 진화,승리한 길거리에서 만나면 깜짝 놀랄 걸요 이게 다 간 양지로 넘쳐 묶고 만나 장사 몽 이에요 약간 지닌 옆으로 거죠 때가 제외하고 쓰 이제 딱 나뉘는 것 같애 운동 포기한 인간 운동을 계속 하면 되니깐 으로 혹인 포기해 먹이 종족이 갈라지는 거 있잖아 호모 에렉투스 라고 뭐 4p 했어요 뭐 달라지는 것처럼 이미 중졸 갈라지기 좋겠어 그 대신 뇌가 발달 않은 줄여서 계속 생각 하지마 소모 피트니스 예 아 뭐야 아 누구야 ost 를 얻을 들어 좋다 너는 쓰세요 너는 호모 수모 마블 꼴아 스 애니 해야 홈피 곳 없고 라스 만에
341,O8cMJZ6K6BA,안될 변비,오늘의 교훈은 바로 겁니다 오늘쪽 음식물쓰레기 문의 궤도를 오랜만에 부르면 몸 풀기가 이렇게 많아진다 음식물 쓰레기 처럼 주기적으로 벌어 줘야지 이렇게 안 길어지고 수면시간을 볼수있더라구요 아니 이걸 쌓은 쌓인 대로 보다 해야되냐 이거에 얻고 메리츠 해버리고 아 지금도 제가 안잡고 음식물쓰레기 게 많거든요 으 안 될 거야 채널을 이 집에서 나가 만나 이쪽 소스 가 이만큼 프로 만들고 지긋한 처리 해야 된다 아무리 제 4대 못 버려 이거는 결국은 어떻게 해야되냐 임프 꽈 9 국가 중간에 프로세스를 제가 결전 인풋이 계속 침투에 싸요 스컬 폴 그런 이미지를 튜브를 줄여 회장 침투 에서는 기회에 속 뚱이 쏟아져 내리고 생각한다 이 돼 버린 데다 타 먹어 봐야 되는 부분인가요 똥을 매 있어 조개 우리는 똥이 안 나와요
342,8IbVxj6geNI,세종대왕님 오열,여러분들은 여자들이 제일 싫어하는 남자들이 누군지 아세요 맞춤법 틀리는 남자에요 그래가지고 제가 이번 기회에 맞춤법 강좌를 준비했으니 까요 강좌 시작하겠습니다 눈을 부라 피다 눈을 눈을 빨려 달하는 말했어요 그 무슨 뜻이에요 눈을 낭심 처럼 땡 그랗게 뜨고 쳐다본다는 뜻이에요 세트가 있어요 죄인은 오펠 받으라 옛날에 이제 입으로 지은 죄는 혀를 뽑아 있기 때문에 없다 뭐 입이 잖아요 입을 열어라 꼬꼬 치국 잔뜩 많이 있어요 꽃이 고쳤다 아 그치 꽃이 고쳤다 는 화보 줘 진짜 확실히 뻣뻣하게 버텨야 할 때를 꼿꼿히 9 라고 하는데 그냥 꼬치가 아니야 꼭 어찌
343,5fIslmZTRFA,입사보다 퇴사가 힘든 회사,지금 제 옆에 계신 분이 8월 수 오전 이미 시고 오늘 이제 그만 두기로 하고 그냥 뭣도 보내드린 또 뭐 하고 논어 g 이라도 좀 하면서 좀 그 좋아하시죠 그 편집 하셨잖아요 그 풀버전으로 짤라서 하셨잖아요 1 봤느냐 만약에 게임을 하는데 하스스톤을 노노 글래머 가도록 하겠습니다 너 그래 폭탄 어떻게 못하 밑에서부터 요 아 o 왜 내가 한창 될 일을 하고 짜자 목수 더 커야 죄송해요 100세 때 잘 봤고 제가 말한 법 기억하는 하라는 기선 데 으 예 그 느낌 되게 꼭 하시길 바라겠구요
344,kjhF7e6kTOo,쭈영감님의 인생 지혜,이게 도매 키안 기뻐요 사람이 왜 그래 작업해야 할 것은 것 같아요 게임 할때는 작업 생각하고 작업할 때는 게임 생각하고 이 그거하고 똑같은 부채 장수하고 무산 장수 어머니를 둔 아들이 아야 아들을 둔 어머니가 있었어 근데 맑은 날에는 우산 장수로 즐 걱정하고 피오는 달에는 부채 장수 아들 걱정 어 어 그거 경우 이런거 다 이룬 더욱 2 3 골드 용강리 와 게임을 할 때는 마감을 걱정 하고 뭐 하도 안 하고 있을 때는 게임만 하고 싶어 지나가던 너가 내가 해결책을 주셨지 맑은 나든 구체가 잘 팔리니 좋은 일이고 비가 온다는 우산의 잘 편이니 좋은 일이고 너도 마찬가지야 게임을 할 때는 이 작은 승리해도 승리를 만끽하고 이 김에 좋아하고 또 마감을 할 때
345,OkGR7nvM9dw,침얼리 - 슈퍼스타,리아 리아 수퍼스타 이쯤에서 쥬얼리 슈퍼스타 팀에서 그댄 슈퍼스타 아 달 처럼 너 때 저희 옆 앞에서 말 그대로 턱괴짤 시킨다고 다비식 아 올라왔죠 으 골절이 쩜쩜쩜 오늘 5기 진짜 사니까 내가 이걸 얘기할 때 이걸 볼 밸브 띄었던 가 없다면
346,Hlh0LktgZZU,주사 얼리 어답터,4 요즘 김치 같은 것도 앤 a 혹시 초록인간 수술이라고 들어가서 엽록소를 중 시켜서 장원의 묘기를 다 비우고 거 합성할 수 있다고 감성을 하고 안먹어도 되고 허기짐을 못 느껴요 내 피부가 초록색이 야 아 그건 좀 그러면은 비슷한 예를 하셔서 얘기하는 건데 그 서명 일도 안 생기는 어떤 그런 주자가 있어 맞을 거예요 맞았어요
347,x-huhGK6QVQ,유튜브 무한의 츠쿠요미,두번째 입니다 1 추대 음 아 내가 좋아하는것을 더 소개해 줘 더 이런거 짠맛 좋아하잖아요 면서 내가 최근 을 내가 왜 일을 하다가 이를 rh 울게 젖었다 이런 감정을 크 때가 있잖아요 왜 그런가 봤더니 정식 환생 이미 계셨는데 정보의 과다 뜬 요 의미 난 사람들은 정보가 과 다해 지면은 똑같은 걸 봐도 나는 사람들은 뭐 그냥 뭐 교육 5 좋은 사람이나 이게 다인데 예민한 사람들은 야 초 말했듯이 있어 색을 기회가 닿아 가 더 예민하게 무능 거야 이사람 더 피곤함과 근데 유튜브 도 마찬가지인데 정부 과다 하잖아요 그래서 는 키워진 그래 내가 정부 유튜브를 잘 안 볼라고 그런데 내가 이것도 유튜브 러 보 거야 그
348,vJJ5qqOXsnc,모낭충 핫플레이스,종이 만드는 다큐멘터리 봤거든요 종이 부드럽게 만드는 방법이 뭔지 알거 돌가루 를 집어넣는 거의 돌까 누들이 뒤 코팅이 돼 가지고 그 울퉁불퉁 한테 싹 들어가지고 매끄러워 좋고 쿠시 돌파로 아냐 되잖아요 협 각질을 넣어도 되는 거잖아요 어 그래 돼요 체 같지도 너무 맣이 써가지고 닫아 버거 보이 지나친 태기가 맛있다고 02 진행하겠다고 있을껄 모낭충 있을걸 문항 추위 타파 먹었나 아 모낭이 없는데다 는
349,gYeYbPZbtXQ,침펄의 인생이 담긴 타로카드,타로카드 카드캡터 트리 나오는 그건 타로카드에 깔리면 타로점 한번 볼까요 앞으로의 10년 간은 쏟아져 이번에 4로 뽑아 주자 잘못되면 10년 조진웅 거야 이 칸테 너의 십 년이 간다 건강하신 해봤지만 파이버드 좀 믹 어찌 버전의 10년을 간다 아 그래서 쿨 한 대 더 후 피망 않으시며 희망 사쿠라 요 꽉 란 뜻이죠 사쿤 할배 이거 겠습니다 지나온 인생 침착 맨과 그의 컨텐츠를 보던 생각 말이야 주민 양말 속 세상 잠보 탐구해 볼까요 쫌 뜯어 우 역 빵입니다 역방향 뚫어 5 격일로 요율표 형상이 아사 왜 시간 10 년 화상이 아 일루전 에 불과해 써 그 역방향 양말 썼어
350,9L_K2M1lYEE,올여름 최고 아이템,이제 밥 딱 한 가정이 될 거고 뭐가 텐데 사실 이 등의 용어가 언트 대장이다 핑거보드 되요 미군 제가 들어가 거기에 뭐가 묻은 네요 다음에 또 이런 기회가 있으면 씩 깜짝이야 목회 묻은 제목이 새끼야 여기 죽었어요 내피 빨다가 요 죽었나 봐 그대로 굳은 체로 죽었어 여기에 여기 껴 있어서 여기 황폐화 되면서 같이 황폐화된 나 마치 크로커다일 한테 수분 빨리 듯이 탈모 그리고 독성 동부 역병지대 섭외 없는데 로데론 언더시티
351,4-XTPNZfyWM,세상 저렴한 더빙,칸지 콤비 플레이 간식 콤비 남자반지 어지고 아누 안 지려고 하면 보고도 받아봅니다 아 자 오늘 단말 부가 ok 참사 pia 피아 1 a 언어 지원 번 나도 한 마을 수 있었지 편차도 싸워 깜짝 보다 다 아 아 아 이게 더 하면은 초 기분나쁘 질 것
352,Ff__pOMW1uo,1분 안에 영화 만들기,호주 kg 오브 데스 내 포토 영화의 시작은 여기서부터 시작해요 엄청나게 큰 악어 를 개발 이랬어 유전자 조작으로 그래서 이제 보러 오세요 하지만 돈을 더 내면 직접 이 안에서 볼 수 있습니다 그래서 뭐 하나 더 잼있다 3 특히 여기에 꼬마 나 이제 어린애가 주고 만들까 어리는 안나오는데 어린애를 달시 넘어서는 깝치는 네가 나와 한 20살 박한 너무 내 될까 아까 불어 약 해봐 해봐 나가 여기고 있었기 보다가 강했는데 우디 계속 금이 가 어 그때도 상황을 딱 말아줘 뭐 빨리해주세요 오는데 그때 직원은 음악을 듣고 있 춥니다 흑수 3화 대 담 뭘 으 아 아 아 아 아 아 [음악] 아 아가리로 하나의 아리아 않았었던 닭 그러면서 위의 도시 청장님 해리포터가 4 쇼 나도 로 바꾸어 켜집니다
353,WhmG7f9X44k,둘 다 경조사이긴 한데...,근데 밥은 뭘 준비 하실 거에요 9척 반점이 있습니다 1인당 최초 타임 테이블로 에서 아 장례식장 처럼 이렇게 봅니다 예 아 아 이제 괜찮다고 봄 느낌 했다
354,HfuclCV8XG0,침착맨의 순두부찌개 철학,난 순두부로 진짜 좋아하거든요 근데 왜 안 먹는 짜라 뚝배기에 나와서 안먹어요 이거 공감한 사람은 있을걸 뚝배기 안 식어 가지고 대 짜증나 웬 뚝배기에 담는 법 위험한데 진짜로 쉽지 말라고 내가 좀 빨리 는 쉬었으면 좋겠어 그래서 싫어하는 거야 꼭 협의를 되게 만들어 그제 그래서 않은 심지와 비빔밥이 찌 돌수 핑 밥을 안먹어요 근데 그건 괜찮아 돌 서시 나와 돌 씻어 있는걸 팝음악 파파돌 수 된 걸 다 막 가서 먹어 뭐 여기는 물을 부어 그래서 누룽지를 해머가 펀드와 왜냐 혀를 안되니까 톤 정도 앞잡이 달라 봐요 그렇게 드시면 되지 않습니다 진짜 r 못 드린 게 뭐냐면 순 등지를 한번 난가 봤죠 순두부집 트 테이블이 부족함 근데 거기서 띠가 한번 더 덜은 그걸 갖다 놓고 먹는다고 아니 이렇게 말하는게 상담자 하남 자트 눈치 보 패트 길에 싹 배틀이 사이코 패스 라고 하는 것은 넘어 갈게요 뭐 그렇게 생각하는거 자유 니까 한데 소시오패스는 홈 인형이에요
355,3J1ApJ8DIsg,왠지 묵직한 머거본 (※더러움 주의),아 다 먹어본 좀 사실 좀 안좋은 기억이 있어요 아 그래요 자 빌라로 이제 안산 처음 이 사람이었어 답 이어 났을까요 전에 살던 사람이 틀어 3 지방 하고 이제 정리를 하는데 참치를 깡통 잇는거 왜 뭐 건강 톰 안 치우는 거야 5 봤어 동이다 24 11 아닌 스탐 봤지만 않아도 실제 왜 뭐 사람이야 말 안 사 등 든 요플레 그래 아니 그 사람이 4번 들어야만 이어 어떻 에 떠 구이 붙어있는게 현상이나 할 수 있어요 기범은 깡통의 똥이 무슨 아이 흐르듯 있어도 요만큼 담겨 있어요 그냥 언젠가 그럼 언젠가 흩어져갔다 얘기할 수 있잖아 꼭 의 지명을 얘기 하냐고 똥 좀 먹어 보이 아
356,9IyXbyDvWtw,한국 대표 초갈,시공 쫄바지 왔습니다 초 들어와 초 들어와 아내랑 커플티 맞췄어요 이렇게 속담이 있죠 초과하는데
357,JcVmD_uBmyk,버거계의 무한도전,햄버거는 비나 퍼터를 발랐는데 행복함 하세요 특별하게 없어요 피넛버터 가 어디에 있는지 모르겠어요 버터가 또 녹차나 스며들어서 안 느껴질 수도 있어 버거킹은 그냥 다 버거킹 그냥 버거킹 마시다 뭘 넣어도 다 그냥 하지만 킹 들이 않은 바뻐 것도 한번 먹고 트러플 들어가는거 그런 것도 봤고 명태 나 세우 혼합한 그걸 버거도 먹고 군대리아 도 없고 설마 줘 얼마다 양의 오징어버거 단 없고 그냥 롯데리아 진짜 좋게 생각하는거 무한도전 무한도전 앉는 자세 공식이 없어 버거에 공식이 없어 정확하게 말하면 큰 부분이 없어
358,Y4msTHCTXxA,예능 오브 더 스톰,그래 그 시점 좀 올리려면 뭐 어떤 요소를 의미 게 싫다 제 생강이 이렇게 생각해 나 혼자 사는 셰프님 들 이 자기 집에서 이제 시작을 해 다 기지 근처에 사는 골목으로 들어가 요 골목에 있는 어떤 정글 같은거 를 활용해서 음식을 하면 그리고 음식은 복불복 게임을 해서 인사 암만 먹고 까 나의 마시는 잔을 아마 야외취침 안되요 그리고 셰프 님들 정신과 감정 봅슬레이 도 타시고 그것을 그분들의 밖으 어머니들이 지켜보면서 토크를 하고 방법 목록에서 요리하면서 가 여주 어때요 그것들에 창 코 그리고 각 기획사 닭 기획사에서 내 피가 벌여 가요 아오오니 무조건 힘들어 엇 이거 보려고 내 마음 된 힛 앤 이에요 춤 개 닿아 힘 대중요리 만 보고 블라인드 테스트로 기획사에서 끼 거 보러 비쳤다 미쳤어 촬영지는 영어마을 그리고 무슨 잡탕 나잖아요 지금까지 몰래카메라 같습니다
359,P587OY3yysU,4시부터 6시까지의 비밀,다음 시끄러워 싸우지 이런 겁니다 뭐 하는 거야 내가 앞에서 어 지금 더 많았다 신차 꾸따 가 아까 낮에 4시 부터 1 6 4 2기를 누워 하는거죠 그건 도에 물어 보는데 이거 모은 돼 아 죄송하며 저는 sbs 그것이 알고 싶다 뜻일 텐데요 이 근처에 위치 다 꺼내 있다고 얘기를 들어 가지구 3 절이라는 그래야 이 거야 바빠 그 시간에 뭐든 중에 궁금해서요 꼬추 달고 있었지 구출을 보셨다고 요 오늘 비가 오는 날씨 라도 고추를 게 좀 안 줘 낮에는 해가 쨍쨍 했다고 낮 에는 앉기가 때문인데요 아들의 끄고 주 안났어 좋겠다 안내상 찍었어 밖에 먼로 졌죠 내 거치고 그 하하 근데 아까 답답한 거친 2발이 빠졌어 아니 주변 대학 빠졌네 한국에서도 7을 말려요 제가 아니야 이 사용제품 1 건져
360,T69Y8Gn-e7g,수상할 정도로 눈에 띄는 티셔츠,저는 사실 이거를 그냥 입고 다니거든요 밖에 근데 오늘 이거 호들갑 떠는 것처럼 보일까봐 호들갑 떠는 것처럼 보일까봐 겉옷을 입고 온 거예요 이거 입고 나가면 아무도이 옷에 대해서 말 안 하죠 의식을 해서 안 하는 거예요 저는 그렇게 생각했어요 이거를 촬영장에 엄청 예뻐요 최근에 끝났던 뭐 유수만 감독님 영화 의 김혜수 선배님 다 보셨겠네요 다 보셨죠 근데 아무 말을 안 하는 거예요 그러니까 아 이거를 어떤 디자인이라고 생각하는구나 배우는 관찰력이 좋잖아요 그린 눈으로 한 거군요 그냥 이렇게
361,xbfwSXc7A1M,미풍양속(美風良俗),형님 먼저 그 아우의 도리에 요렇게 여러분들 보세 배우세요 아무가 어떻게 해야되는지 우리나라 사회에서 아무가 어 이거 어머님한테 먼저 아우가 말하잖아요 왜 이렇게 마음 마라 느껴요 아우가 형님 챙기고 먼저 이렇게 딱 하면 양보하고 이런 이런 부분이 우리 동방 예의 지국 이라 불리는 우리나라의 좋은 모습입니다 주제 반품 미풍양속 따라서 미풍양속
362,B4C-T-Mt5yo,똥참맨 & 똥참펄,아 악 예 아 볼 때 3 입니다 아 그걸 가능 찜 사자 반대로 깨워야 되요 그래서 앞에서 못하는 데쓰 진하게 뒤에서 딱 보임 아 아 아
