,id,title,transcript
472,kSp_dynfKZM,서울 사투리 따라하기,위하여 지금부터 출발하면 용인 이면 한 2시간쯤 과녁 하다뇨 아주 길이 많이 막히기 때문에 주말에는 시간을 잘 맞춰서 가야 한다는 말입니다 그렇기 때문에 뭘 할 일 중 시죠 아 주말에는 가족 들어 같이 등산을 사회 생각인데요 부모님 한테도 이사들 좀 된 게 좋을까 싶다 아 부모님께 인 달래는 아직 효심이 지극한 되는데 잘 들었구요 다음 뿐만 만나보도록 하겠습니다 그래서 누구 시죠 저는 강동 부산은 치켜 보게 됩니다 오늘 어떤 일로 기 나오잖아요 저는 방 속을 끄기 위해 왔습니다 이렇게 여자들이 하는 헤어밴드를 하는 이유가 어디 있습니까 뭐야 그걸 한 알을 낳았어요 누가 이거 했을 때 기분이 많이 좋아집니다 잘때 꼭 하고 자요 저분 한테 물어보면 안 될까요 맛있잖아요 실용적 이기도 하구요 아방 분들이 시종이란 말씀 하셨는데 어떤 부분에서 실용적인 지 무척 궁금합니다 제가 보세요 모자를 쓴 것 같기도 하지만 r 쓴것 같기도 하잖아요 전 그런게 주더라구요 모두 자신만의 생각이 있으니까요
473,UbaL8cVRNtE,무례맨,고집이 있고 주장이 강해 안가네요 예 전혀 강 하자 주위에서 뭐 그냥 짬뽕 먹자 보면은 질환 하지마 짜자 끌려간 뭐가 이거 이루어진 않아 아 힘들어 재미 임야 고로 3가지 알아 괌 뻔 짜장 풀 싸 움 서 가 그 얇 사람이 어느 머리에 막 짬뽕 막 비비면서 마 어때요 그런 경우 못 봤어 이런 상상 아내가 갑자기 따라 몰더 춘장 팍 퍽 아 지금 막 잡혀 봤는데 무슨 상상까지 한자를 순간적으로 형하고 찬 - 있어 지금 막 줄줄이 수영이 마 화가나 가지마 화가 나가지고 짬뽕 라 해서 팡팡 하다가 이게 다 알게 됐어 따갑지 사람들의 평을 닭 보더니 갑자기 자연스럽게 줄을 쓰더니 머리를 찍어 가지고 옮기기를 그 종 이렇게 옮기는 것 처럼 마지막에 중앙을 있지 그 주방장이 착 다음에서 처우 레제 여기서 얼마나 전달이 됐는지 되다 2
474,ljGPJzkmxUU,벌레아저씨께 전화 찬스,흰개미는 회 안 먹어요 걔네도 나무 회 먹을 걸 살아 있는 거 아저씨 자 다 함께 불러볼까요 벌레 아저씨 벌레 아저씨 계세요 예 안녕하세요 벌레 아저씨 그 다른게 아니고 궁금한게 있어서 전화 드렸어요 흰개미는 썩은 나무의 둥지를 틀고 살잖아요 근데 흰개미는 과연 생나무도 먹냐 당연히 아시겠죠 벌레 아저씨인데 당연히 팽나무 도 검색하지 마시고 바로 대답해 주세요 왜 자꾸 버퍼링을 걸어요 아 그렇죠 살아있는 나무랑 흰개미랑 일대일로 붙인다 100% 먹을 수 있겠죠 제가 연구 중이거든요 지금 영국에 있는 지금 대학하고 같이 말씀 감사합니다 예 줄벌레
475,cMjZqVUR5ZQ,배 설명회,히히 요즘 발사 배가 왜 이렇게 잘 보이지 이게 그러니까 옆에서 보는 거예요 이렇게 있으면은 이렇게 제껴지더라도 스르르 올라간단 말이야 그죠 이게 일반 그냥 배 근데 어 나와 있는 사람 예를 들어 예를 들어 있다 그럼 여기서 옷이 이렇게 걸려있다가 아침에 일어나면요 나 이렇게 누가 벗겨 놨어 이렇게 크롭티가 되어 있더라고 이게 너무 싫다 이게 그리고 여기가 굉장히 습기가 차거나 답답해 그렇기 때문에 빤스를 여기까지 올린다
476,DbgfsvApIrU,(前)기안84 동거인의 쿡방,반숙을 좋아하는 분들이 있거든요 반숙을 한번 보여 드리도록 할게요 뒤집 기 하나 이거는 그냥 저는 이렇게 이렇게 찢어서 손 씻었어 아 계란
477,GHdrXe7vq_E,지독한 양말 아저씨와 팬티맨,좋습니다 너무 좋아서 막 너무 그리웠어 아 그게 아니구나 다시 뵙길 없나 했더니 어 5 아 뭐야 이거 뭐 나무 전우진 이에요 이거 구멍은 날 수 있으니까 무신경 했는데 이건 보여준다는 게 아이야 다우 얼마다 위험을 먹을게 된게 그 분들 이제 저희 양말을 살 때가 된거 같네요 이제 펠트 있잖아요 중학교때부터 계속 입던 보건데 어디서 사퇴 학교때 인가에 이게 엉덩이골 회 보니 처지입니다 왜 맞어 맞어 한국형 이게 박명희 수도 있어 소스 치니까 그럴까 오버 사다 맞아 펜 4 실험 벌의 니코 민가 한번 초토화 되거든요 저 엉덩이 부분이 진짜 자기가 그것처럼 다녀 어느샌가 집에 110번 읽기는 있는데 그걸 쑥 하잖아요 쑥 치자 적은 야 그냥 버리고 한번 걸리겠지 원래 봤어요 1 섹시 봐봐 뷰러 진짜 한거 자 한번 쳐서 마셔봐 마지막 마지막 팔아 순간 우리 얘기를 하는데 지점에 그랬었잖아
478,ehzLwjpTWUY,요리의 참맛,먹어도 되나 이거 한번 조리한 거라 먹어도 되잖아 말짱 말짱 화석 발굴 하는 사람이 이런 느낌일까 내일 중간에 하나씩 먹는게 요리 맛있지 이수자로 먹는데 쓰던 젓가락 먹기 싫음 안 먹어도 돼 간접키스 할 거면 먹고 싫으면 안 먹어도 돼 알았어 이제 고기 안 먹을 거야 이거 솔직히 참기 레벨 99다 솔직히 이렇게 못 했는데 뛰어 먹고 싶어 안 보고 싶어 내가 괜히 뜯어 먹는게 아니야 이게 샤브샤브한테 자 젓가락이 안 닫고 먹으면 되지 그렇지 샤브샤브로 넘쳐 맛있네
479,4ANM5BCkoX0,가짜 뉴스의 대향연,러시아에서는 미국을 안 좋아해서 러시안 오라고 하던데 진짜로 진짜로 아 진짜 이거 진짜 진짜 진짜 검색해 아메리칸 호러 검색 진짜 진짜로 러시아에는 아메리칸 대신 러시아 너 왜 이런 식으로 기사가 막 나왔는데 니가 얘기한 거야 처음입니다 한 거잖아요 SNS 아무도 안 쓰는 말인데 어떻게 적절하게 필터 렉이 됐어요 그거 하지 마세요 그럼 이것도
480,6RV8CxiPIzw,침착맨을 실제로 만났을 때 느낌,그냥 아저씨 라고 생각했던 사람이 실제 모습에 가깝게 캠으로 설정을 해서 좀 잡아 내니까 당황스럽다 아 좀더 큰것 같아요 실물은 이런 느낌이에요 실물이 순 지키며 근데 여러분들이 하도 잘 밭에서 찍은 것 같은 느낌으로 계속 보다 보니까 아 거북 느껴진다 자 이렇게 캠을 바꾸게 된 이유는요 제가 밖에 나가면 자꾸 놀라요 자꾸 놀래서 아이 결의 감을 없애겠다 캠 하고 실제 얼굴에 괴리감 없애겠다 싶어서 다른 사람들 혼란스럽게 만들며 안되겠다 싶어서 괴물 부득이하게 바꾸게 됐습니다 조명도 좀 달고 여러분들이 여기에 적응 하셔야되요 0점 을 여기다 맞추셔야 g 밖에 나가 셨을 때 저 보셨을 때 심장마비 안 걸립니다 사실 저는 트위치 에서 방송 하면 안되요 v 라이브에서 야 된 사실을 근데 오늘 부로 튀 직 계약파기 하겠습니다 v 앱이 더 어울려 낭패가 vfr 이제 앞으로
481,V57-QzaaoiA,둘째 큰아버지의 재밌는 카톡,출제 큰아버지가 가족 단톡방 에 재미있는 글을 올리셔서 좀 더 읽어 드리도록 하겠습니다 자 배꼽 잃어버리고 외양간 고치지 마시고 배꼽 잡고 들으세요 일본 양로원 협회에서 주최하는 삼행시 의 짓기 입선작 모험입니다 나는 연상이 이상형인 데 더 이상 없어 전철 개 철구 안 열려 봤더니 이거 진 찾고 led 전구 때 남은 수명 으로는 다 쓰지도 못해 희생의 미뤄온 없다곤 하지만 지 지낸 도망 과 주변 사람들이 칭찬하는 글씨 츠 사실은 손떨림 의사가 갑자기 상냥해 지면 불안해 펜과 종이 찾는 도중에 쓸 문장 까먹어 가슴이 떨려서 사랑인 줄 알았건만 진찰결과 부정맥 7 잼 짜 궁금하시면 가족방 구독해주세요
482,CXCxn4jMyfY,철권 준비,라떼는 껌 은박지 다 모아서 책상도 백은 비치는 쌓아왔다 여기 여기를 은박지로 껌은 박지헌 보배 않는다 이렇게 은으로 만든 근데 이게 은은 안좋은게 서서히 하면 할수록 이제 선생님한테 적발될 확률이 높기 때문에 반절정도 했을 때부터 이제 선생님과의 승부 야 자기와의 승부가 아냐 그때부터 그래서 발각되어 c 자기가 끝자리에 있으며 는 안 좋다는 걸 좀 말씀드립니다 왜냐하면 은 권리 줘 선생님 와요 검술 띠고 뭐야 하면서 이제 맞죠 맞으며 는 중간에 쓰면 맞으며 주께 막 간단 말이야 하면서 언제 언제 끝이 도착해 보면 한 중간 정도 맞을 수 있는데 끝자리에 쓰면 은 맞으면서 그 그 철 번 맞으면 이렇게밖에 뜨자 나 어 철권 뛰면 뜨듯이 그 거기까지가 교당 까지가 이때 앞에서 제 친구는 실제로 말 대단했어 선생님이 기회를 한두번 줬던 것 같아요 근데 얘가 끝까지 되 들어서 철저한 준비 어쩜 속 가다가 독도까지 나왔어요 복도에서 도 철거 어땠어
483,xdNgjJ4gLd4,그 시절 버스 이야기,근데 그런 건 없었어요 아따 하고 있는데 줄여도 밥주고 있다가 이상했다 하다가 내가 오히려 머리는 이렇게 백비 그런거예요 근데 아무 까나 뿐 않네요 다 둘러 짜아식 했다 번 여자나 저희 그런 내렸어요 아빠 버스를 어떻게 짜 나요 막 뛰어 써 보아야 철판에 너한테 퍼스가 5 젊은 들이 잘 못 해 봐요 그런데 그때까지 멈췄어 가운데 빨라야 돼 나 아아 다는거 아까 나중에 그 기묘한 모험이 시작될 그럼 그 당시에는 버스 기사 아저씨들이 그렇죠 무서워 말라 는 물론 춘절 아저씨도 있었는데 앉은 아저씨가 돔 알았어 아저씨 이야기 그 뭐 어디 뭐 중앙중학교 가요 여러분 데 헤아 아 하 아 으 너무 어린 건설 절어 서울을 해보자 해서 자기 탈 버스 아닌 문열면 미안하니까 필수적으로 안 한다는 제스처를 초 밥을 이렇게 받아 아니라 아닌가요 왜 그러고 딴데로 한방차 파자마 하죠 저는 이것까지 다 나거든요 으 클럽 빵 고 않으려고 있었던 생각이었으나 팔아 해봐요
484,408y8qWmqaA,호크아이 슨배임 좀 챙겨라,코카 이 야호 카이 좀 앞에다 좀 해 줘야죠 아니 좀 설 없잖아 아니 호크아이 제 처음부터 나왔던데 뉴 캐릭터 나오는데 왜 점점 뒤로 분의 짬 순으로 해야지 씩 1 바바에 블랙 펜 선을 딱히 로하 잘 알아서 씨가 눈치껏 따 왔는데 여기서 짬 순으로 하잖아요 이따금 보이잖아 야 이걸 뭐 그런걸 써 모터에 티로 가 뒤로 가 이계 싶다 했는데 z 이러고도 들어가서 옆으로 가져 빠져 순차 미스 이렇게 해야 되요 기금 근본이 없잖아요 일단 보니까 근본이 없어지고 워크 아 이거 지금 여기로 가 줘야지 눈치껏 한가요 아 이걸 9호 하셨으면 선배님이 쪽으로 시절 아니야 다 이렇게 편에 뒤에서 포지션 잡아가지고 활쏘는 내라 다는 그 안보이는 곳이 편에 하여 차면 이 오세요 아냐 그렇게 여기 갈 아 안되는데 어 자 자 찍습니다
485,CPscvpLTPcI,편의점 알바 꿀팁,이런 경우가 있었어요 어떤 술 천천히 먹어 가지고 계산을 하는데 조직폭력배의 느낌이 났어요 아 형님 병행 벗겨지는 지금 하는 거야 좀 약간 취해서 한테 갑자기 나한테 술 닦아 타면서 기다랗게 오더니 요즘 학교 방 요구하는 갑자기 밥줘 붙죠 난소 있는데 근데 그때 나 혼자 알바 있으며 는 뭐지 당황하고 용 도 없고 계산하고 끝났을 거야 네 옆에 점주 사장님 있잖아요 참을 수 없었어요 뭐하는거냐 옆에 또 치워 줄 사람이 있으니까 뭐 하는 거냐 바가지 긁다 졌지 옆에 그 보스를 중간 보스 같이 보이는 그만의 그만해 이제 막 했고 나가지고 끌려가면서 또 이 새끼 노다 중에 반발을 저한테 오피스텔 비었다고 있잖아요 거기 사는 사람이 어떤거 며칠 뒤에 왔어 업소 나한테 딱 이러는거 니네 아 이제 그래서 개 빡쳐서 가지고 뭐라 자료 예 그냥 원래 같았으면 돌았으며 는 아예 일을 했을 텐데 진짜 맞췄기 때문에 저도 네 그랬어요 니 그 잘못해 놓아 네 너 진짜 와 일단 못지 않게 되도록 잘못했습니다 홈스 딱 하더라구요 항상 그 편의점 생활을 유아 게
486,4EML4Xj4fe0,어쩔업보,아 배부르다 통한 먹고 싶다 혼란은 먹방 하는 사람한테 금기시 되는 거야 그냥 탄산 있어가지고 1 사이로 먹으라고 비슷하죠 이수 전입 체제 좀 좀 내주자 어쨌 1 첫째로 이제 재심을 좀 어떻게 해봐 그냥 보고만 차라고 처치에 팀이 자체가 한도 끝도 업체가 지금 이 방송한 지 사십 뿐인데 쯤 아직까지 하고 있잖아요 왜 내 뜨는 거야 자 어쩔 때 10절에 티비를 다 같은 사람입니다 예 아 아무튼 뭐 예 아직 좀 해봐 누군지 모르겠지만 내는 필자가 안 보이게 하라 고 내가 매운 자면 펜 이제 보니까 방제를 아 내 가방 저를 어쩔줄 기초 쩔 집이라서 그래서 내가 왜 어떤 집 합 아침 아침밥을 아파 아 그렇게 보내기 치크 라고 했지 근데 4 내가 아
487,kmQcZhSQgno,양말 부스터 가동,그 해야 돼 * 부터 or 미국식 내가 환장하는 미국식 떡밥이 4 수도 법이 뭐 뭐 다 궁금해 그냥 목 완전한 먹었지 3.6 잃을 염려 없어 쓰지 야채 야채 말 자체만 땅에 그래 그건 잘 됐지 확인 할게요 언급을 22 쭉 그릴 냈던 자금 다시 그렇게 하려면 지금 캐치해서 어찌 맥 열러 에 [음악] 녹음 이게 이게 제거 좋게 폭 으 다 꾸기도 하고 있어 져 그래서 미국식 새우 닭고기 덥다 매력이 흘러 깊에 퍼기 다진 할라피뇨 게 정부 5 브로콜리 에 다질 8 배뇨 그렇죠 이렇게 그렇지 넣었어요 요청 법 마이 들면 다 이해 어쩔 수가 없어 리들은 마디 안 되겠지만 야 눈 떠보면 갑자기 요 잠도 모르게 op 씬 가고 있고 그런걸 달 들면 다 그래요
488,-ZATH0M6DvQ,인싸 vs 아싸,요즘 인사들이 먹는다는 맛있는 음식을 앞 십시오 멘트가 달라요 똑같은데 그러니까 인사들은 이렇게 포장지만 바꿔도 좋아합니다 일어 이것 자체를 즐겨요 한해 소소한 이벤트 자라 소 악행이 자나 그쵸 예 얼마나 재밌어 내용으로 그대로인데 이름이 달라 얼마 재밌어 그쵸 아싸 들이 진 찍 빨면서 음식을 음식의 맛이 왜 이래 이렇게 해가지고 유쾌하게 못 먹고 진지 빠지지 인사들은 더 한번 먹어봐 아 엄마가 아싸 드럼 근 진해서 이게 대체 팔릴 거라고 생각하고 반응 건가 안경 올리는걸 외도 사회 요 무지 하시나요 썬글라스 듯 아파 릭 앤 독 자 이카리 겐도 들러 합니다
489,-JOsg-if6RM,꼰글리쉬 일타강사,자마자 10 뿐인데 어떻나요 그러 업어 스피릿 절대 울지 마 오버 스프링 엎지러진 물 억지로 고 나서 올리지 말고 업 찌르기 전에 자느라 있으니 대작을 있을때잘해 아마 이런 주시죠 자체가 억지를 코 옆에서 치밀어 옛날에 푼수 해야지 제 마법처럼 될텐데 음 어 낌이 쉬어 순을 어 초아 r 어 맛보다 봐요 ode to oi 테이스트 빨리 아 으 아 말 이예요 왓 아이 새 l5 won 이런식으로 해는 것이겠죠
490,odX5AL10rgE,새로운 광대로구나~!,나중에 한번 입었어요 너 이거 기자 보고싶다 그렇죠 네 읽어보세요 이런걸까 5 [음악] 물론 할 거 없어 또 뭘 하려고 올해 어 그쳐 짜 미쳐버릴 아 아니 심야 뭐랄까 미쳤다 냐 나왔다 아 아이팟은 맨 밑에 깔아 카페가 썼으나 왔다 그래 딱 유니콘 나와버렸다 닉쿤 말처럼 한번 달려보세요 형 국어 4 아 보고싶다 1 저거 한번 했어요 인데 무 보셔도 한번 했어요 한번에 깨어지며 생일이니까 굉장히 깔끔합니다 아 보 4 6화 생 로랑 하하 이제 네 컸네요 [박수] 사람입니다 아 우리 밤에는 저희가 숫자를 아마 주도록 해 가방 태 거야 옛다 나와 받았다 아 으 날
491,FWpzk9HJ7w0,딸천재 침착맨,이것은 작아져야 될까 수요가 초코 했을 거에요 왜 해야하는 4 조사 앞쪽에서 받아 갔는데 계속 누릴 껍데기 좋고 있었는데 그걸 되지만 태사기 과거 해서 방법이 면서 역시 우리 떤 체 붙어있던 봐야 넣으세요 그럼 뭐 그래요 그럼 아까 닮았나 봐요 안전한 칼국수집 싸서 더 주기 중에 껍질 안 버리고 뭐 하하 아니라고 박아서 대로 바라고 방은 물질 대해 풍요로움에 익숙해 지는 걸 저의 경계합니다 이 계단 여는 시 되면 돼요 소양이 바지가 짧아 타악 마세요 내가 얘기한 거야 진짜 제후 2 잘봐요 할인 우월한 미술 봤을 때도 됐잖아요 com 날 속에서 그렇게 본다면 저한테 벌 수 양한테 그래야 주시오 어 아 아 아 여기서 하세요 시속 톡 명 남이 죽어야 할 수도 없다 이겁니다 넣은 다음
492,SL1eCxsy8Og,금니 자랑 창법 - 눈의 꽃,어 이새끼 길을 진 괴인 자의 따라서 땅거미 제너 투 쑥 으 그대 와우 그 있네 이 왜 레미 2 [음악] 자다 그 집만 피 좀 갤 2의 계급의 그 저 실키 가리 그 위를 으 으 및 엘븐 의 에 게 저희 now [음악] a look for 아휴 del 예산의 맘이 gloria a ve
493,0rzExaHeNM0,세심한 블랙기업,넣을 수 있어요 쑥떡을 취지 뭐고 이거 뚱뚱이 되라는 거야 메뉴 선정 누구 하셨어요 메뉴 선정 2 거였어요 맨 3 정도가 있어요 메뉴 산적 누가 있냐 고 기름을 뭐 누가 이니까 저지 시계 끄면 자 같은걸로 해달라 같거든요 같은거 먹고 있는지 봐야겠다 뭐 시켰어요 이것이 겠어 봐바 타 먹었다고 또 거짓말을 좀 올려주세요 우리 deer 뭐 알리바이가 영수증까지 만들어 놓은거 이게 소인배 야 세심한 사람이지 누가의 그 뭐 누가 네 하잖아
494,5kGC3oRFQYY,(더러움 주의) 수납형 엉덩이,휴지가 없을 때 나는 이거 되게 사소하다고 보는데 이것을 너무너무 위기 라고 생각하고 못 나오는 사람도 있더라 그냥 안타깝고 나온 되잖아 그 나중에 가서 따끔 되잖아 왜 왜 못 나오는 거야 어떻게 따 거야 어떻게 나가요 보면 안타깝고 않다 꼭 그냥 올리는 거죠 팬티 그래서 엉덩이골 아내 수납한다 똘 일단 일단 어쩔 수 없죠 교민 하자 그 빨리 부르자 닦으면 되니까 왜냐하면 이 수납이 되어 있기 때문에 암 묻어요 일어나서 표면 할게요 4 으 아 아 으 3 바지 그렇게까지 많은데 바지 내리고 받으시고 여기다 걸고 성이 앞에서 요 걸고 그 무슨 등 가리고 2 인삼과 가듯이 그렇게 가지고 근데 그렇게 얼마 안돼 말러 쭉 납을 하고 걸어야 돼 엉덩이 쭉 빼요 엉덩이 골의 그 붙이기 싫어서 아점 마르는데 안되는데
495,nw9mt8r3v5A,헤이 멀럭!,팔머 너무 뛰어나 꿰어 왜 뜨 오해 7 아마 명령이야 이놈 싫어요 어떻게 해야죠 이거 아라스 제작되는 프로그램 업데이트 됐습니다 그럼 상황 및 어제 아 이건 냈고 여기 딱 하지 않습니다 이건 뭘로 개 같은 거 다 팔아 버리고 싶어 어떻게 이렇게 내 그 그리고 내 그 내 그 8 그 4 너희 그 양자가 굳이 나라도 게이지로 양구 싸 앞지를 감사합니다 이 거유 애니 야 뭐 안되고 올라 친한 몇 명도 없는데
496,4KUbglew3Iw,침착맨식 눈높이 교육,아 i die 아예 빨리 그런거 흰빨 부정 더라구요 부정 잡아라 으 아파 고요 좀 이렇게 되고 싶어 안 주고 있고 아까 24 저렇게 안되는거 께 하겠어 이렇게 자기 전에 어떻게 하겠어 어깨끈 패기 뺑 거야 아직도 아까 이겠지 이빨 왔답니다 그래요 이 안타까운 토 스 라 엘 처럼 대 에 와서 주술사 된다고 이 꼭 딱 9 그리고 밥 먹은 다음에 뭐야 겠어 물 한잔 마셔야 겠지 에 한 먹고 입을 헹궈야 돼 그래야지 가 이제 총 졸업 아무리 다음에 또 영구치가 나긴 하지만 지금 현재 녹을 소중 해야지 여우 지도 아껴서 잘 쓰는 법이야 알겠지 에 알겠어 아 싸워 좀 무서워 예 괜찮아요 제가 잘 될까요
497,TFalV8AIrUI,철수는 노래가 하고 싶어,별님 담아왔어요 음 아 노래 뵙겠습니다 네 라고 맞아 알게 뭐야 지금 행복하니까 1 으 하 않을 낸 4 몸이나 겠지 안양 그렇게 분이라는 것도 아예 봐라 10 라 필요를 자 인제 안타까 말 으 도수 눈 출가 와야 그 부끄럽잖아요 가사를 이루어질까요 플로레 잘 아시니까 그냥 이런 좋은 거에요 노래를 부르고 싶으면 2번 줄어요 이번 주 적 자 1 그 아띠 듯 아잔 나 너를 l 르 사람이 여기 다리 날 뭐가 규리가 뿐 지나 무브 귀 김 대라 너도 레제 뭐 하고 다니니 밥을 것보다 지금 실이 퍼온거 아니지요 아닙니다 시들이 씹어 먹는다 5조 진짜 신의 보신것 갖춰 것이 그 밑에 루스 쉬는 법을 안 뜨네 아니거든요
498,2077lNGgzio,확인해!,5 영어 빨리 맛의 진수 g 또 집에서 두고 있습니다 보고 있는 부대를 밝게 나라 확인해 확인 하란 말이야 다보니 야 전문가 에서 나온 엄청 무거운 게 뻔하잖아 확 이제 봐봐 파기 내의 하나는 돼 으 아 네 예 oo 하하 9 ira 여보 아 예 으 확인 해 물어보기 4 확인하러 가
499,-2M-O8dfGKI,최고민수 vs 유사민수,heren 지금 뭐 알라가 씨까지 요 예 어떤 것일까요 뭐 이제 자주 파코 잘 먹을것 봐야지 으 십시오 다니십시오 선생님 언제 이따 미스 싶었다 봄 그냥 거 아냐 끝났어 스포츠를 끝남 왜 c 에요 그렇죠 * 40자 봤어요 그 학생이 좌표 정해요 끝난후 거 저거 보면서 내가 뭐 업무 멈췄지만 버퍼 맹장 이거 참 제가 집중력이 되게 떨어지는 병이 있어요 집중력에 관계가 2시간 시간도 석실 안 되죠 20분 정도 지나면 그 발작을 하고 발전 없잖아요 [음악] 한번 보자 오늘 해보니까 만나봅시다 먼저 하겠습니다
500,jZz9GnON-8c,펄부리 영감,[음악] 축축해 구체는 축축해요
501,vO_Ecbujpj4,커닝시티,못 버티고 도망갈 수밖에 없죠 더하거나 아버지가 있으니까 언제는 것 그 어닝 거닝 시티 거니 까니 건 인 그 어닝 시즌이 까 깍 아까부터 건지기 그거 아까 파크 카카 다행히 cb 카 깍 깍 카카는 다희 싣지 거 같아 까톡 아님 식기 깎아 가까 간이식 게이 카 각각 악한 당한 씨티카 딸 딸 딸 딸 카 이럴때 이때 리카 거 같아 카 란 ect
502,TxrvdIRGU50,전무님의 김치 개인기,그냥 밖에 회 밖에 2칸은 김치 금 갱신 캠 시계 김치 개 김씨의 밥에 물 말아서 먹었는데 서너 그걸로 살짝 진짜 그건 크잖아 무슨 김치 5 배추김치 5 이쪽 어찌 좀 해 줘 그 본체 잡아서 어쩌죠 씁 br 찍는것 교제 왜냐하면 비화하는 되게 광센서 근데 짓는게 가을 짜서 묻어있다 훨씬 맛있어 왜 거지 그 어떤 시각적 또 이 포만감 입에 들어갈 때 어떤 그 포만감이 이런 것들이 거 없죠 그린다 국물에 창밖 물통 말아서 같았어 김치도 막차 지 막 으 쳤지 줘 가도 되냐 따른 막 그 모든 소리가 허락을 5 나는 그제 바깥 쪽 입장이 있잖아요 타란 잉 파랭이 예로 밥을 감사합니다 3 짝을
503,c-mvQ4y3slw,안테나 이슈,군대있을때 밤에 그때 키비 nj 쓰라고 되게 야한 프로가 있었어요 그걸 몰라 키고 볼 때가 있었어 고참들이 근데 방학이 막춤을 청하게 원 벌떡 벌떡 받으면서 이제 막 으로 바꾸고 있어 근데 갑자기 박쥐 거거든요 뭐 이래 그렇게 안테나 반지도 막으면 와 북해도 지도 밑에 막 일병이 올라가서 안테나만 정해서 그 여기서는 만난 테라 간헐적 가는걸 만족을 써 10 새끼한테 라바 칠까 아 좋아 하잖아 이런 미국 개굴 아 이게 아닌가 벽돌 아닌가 벅스 허트 한번 놀라게 했는데 근데 이게 안테나 야 아야 않던 얼만지 되니까 다는걸 만 잤다고 4 아
