,id,title,transcript
181,kmINsflubYg,진짜 뻘짓 하지 마,진짜 뻘짓 하지 마 진짜 뻘짓 하지마 지겨워 치지 마 사람 치지 마 사람 치지 마 차 치지마 사람 치지 마 차 치지 마 사람 치지 마 자치지마 사람 치지마 잘 치지 마 사람 치지 마 사람 피해 사람 피해 사람 보면 피해 아 차치지 마 사람 치지 마
182,GTpc2gHIcfo,감동해서 우는 애기,이런 식으로 만화 소재를 얻습니다 우는 애기를 보면서 혹시 너무 감동해서 오는 얘기도 있을까 아니 이거 어때 좀 클리셰인데 모유만 먹다가 분유를 먹었더니 우럭 갑자기 근데 엄마가 아 분유가 맛이 없어서 그렇구나 해서 치웠는데 알고보니까 너무 맛있어서 감동해서 온 거였어 우리는 아직 감동에서 오는 거는 밝혀졌나요 이게 만약에 실제로 감동에서 우는게 있다면 분유 먹였을 때 우는 아기가 싫은 맛있어서 우는 걸 수도 있지 않았을까 소영이한테 물어볼까 최근에 애기였으니까 전직 애기였잖아 소영
183,yo1Yxo27-XY,스톡홀름 증후군,트럭 한번 해 보자 너무 무거워 얘도 같이 가주네 운전석에 탔어 운전석에 타서 같이 가죠 도와주네 내가 못 끌고 가니까 도와줘 [음악] 잘한다 잘한다 잘한다
184,6yWAEkKBXl8,근데 왜 나한테 총을 쏘지?,생각해 보니까 불법 주정차 있는데 이게 차가 멀쩡하면 안 되죠 수박씨 좀 만들어 줘야죠 근데 나한테 총을 쏘지 갱들이 반응했나 신고 좀 하자 나한테 막 총수잖아 경찰 나타났다 다 잡아가 싹 다 잡아가세요 저 새끼들이에요 아 경찰이 쏜 거였어 경찰 불러가지고 그래 저 새끼들 총 쏘면 저렇게 된다니까 난 상관없지 나는 아무것도 안 했는데 그냥 제가 갑자기 청소하는데
185,1LAsg9z0APA,빈정대는 거 같은데?,나가주세요 [음악] 손님 같은 사람은 필요 없습니다 이유 비벼 먹어서 이건 어떻게 생각할까요 일본식 카레 먹을 때 비벼서 먹지 말라고 하잖아요 존중해야 된다고 보는가 아니면 그냥 제 맘대로 먹어도 상관없다 지금네 번씩이면 이거 우리 이렇게 들고 먹고 있어야 돼 엔더 끝도 없다 현지처럼 마치잖아 일본 영화 보면 그래도 되는데 결론은 음식은 그 나라에서 먹는 방법대로 먹는게 아무래도 더 좋겠죠 이런 채팅이 있어요 그러면 우리 카레니까 물 한잔 떠보세요 손씻어 자 인도식으로 갑니다
186,Sb6-dI2v0n4,제가 감히...,원래 폭식 잘합니다 나눠서 여러분 나눠서 먹는 것보다 한 번에 폭식하는게 배가 잘 나와요 왜냐면 갑자기 들어온 영양분을 다 저장할 수 있는이 지방으로 바꿔 가지고 축적을 해놓기 때문에 [음악] 제가 제가 주름 잡았네요 제가 감히 노하우를 굼벵이 앞에서 노하우를
187,7EwMx3VcArc,푝푝맨,침착맨 님 좀 더 맛있게 드시는 방법은 입을 크게 벌리고 거리면서 드시면 진짜 먹방처럼 보일 거예요
188,PHkpRSYBlaU,충견 촙,저 이렇게 해 봐
189,NBZxU6Wfs0o,기싸움,[음악] 나와라 나와라 나오라 했다 왜 이렇게 튼튼해 이거 아 죽
190,6Q6WPPYTlZU,맛스라이팅,맛있어 맛있는 거 마시는 거예요 바보 새끼야 맛없다고 해도 좀 이상해
191,xOxa4pmyZ30,침 VS 침,말차 맛이라는게 그냥 설탕만 아님 설탕 안 들어가면 안 먹잖아 그렇게 치면 딸기도 안 달면 안 먹지 초콜릿 우유도 단 거 없으면 안 먹지 그죠 방금 케이크 때지가 했던 말인데 당근 케익 있지 당근 맛이 안 나서 맛있는거야 그치 내가 그때 주장했던게 뭐냐면 당근 맛이 안 나면 안 날수록이 당근 케이크는 맛있다고 말해가지고 그런가 설탕 맛으로 먹는다 당근 맛이 지나면 지날수록 맛이 없어 당근 케이크는 당근 향이 거의 안 나 엄청나게 은은해 근데 그게 옅을수록 맛있어 당근만 진하면 맛있어요 근데 이거는 진하게 먹자 다른 거지 좀 다르다고 보는
192,d5NvM-6aHZ0,인간 낚시,도로 있으니까 하나 그 어떤 타볼게요 낚시 한번 해볼게요 나만의 낚시 개새끼가 아 얘가 퓨마야 아 걔가 아니고 야 여기 숨어 있네 찻집에서 퓨마 있나 없나 확인
193,Eutkft1lj38,호크아이 활 도우미,호크아이랑 호크아이 화라고 싸우면 호카이 활이 더 셀 것 같다 둘이 사이가 안 좋아졌어 둘이 11월을 해 야 너 때문에 약자 취급 약자 취급 받는 거 아니야 야 너 때문이야 야 뭔 소리야 호크아이 이대로 괜찮은가를 해 그래가지고 호크아이 화라고 호카이가 싸워 그래도 호크아이가 질 거 같아요 얘는 영웅 이름을 바꿔야 돼요 호크아이 활로 호크아이 활이 영웅이고 홋카이 활을 그 나가게 도와주는 도우미로써 호크아이가 이제 옆에 사이드 킥으로 붙는 거죠
194,X12sg_da68s,윈드밀 가능하신가요?,믿음이 가능하신가요 윈드밀이 이제 [웃음] 다리가 찢어져야 돼 다리가 찢어져야 되는데 아 이런 거 알고 계세요 다리를 찢어 다니엘 드리려고 해야지 그게 아니라 [음악] 이렇게 빠르게 아 이거 불법 같은데
195,SKs3Kd6ypw0,매운맛 영감님,하지 마시지 마 하지 마시죠 그 와중에 맵네 매워 영감님 계시겠죠
196,XNTDDsLsryg,제로 떡볶이,제가 생각했을 때는 떡볶이라는 음식은 이미 완성됐어 완벽해 완벽하고 이제 어떻게이 맛을 유지하면서 건강해질까를 생각하면 될 것 같아요 제로 콜라처럼 재료 떡볶이가 나와야 된다 재료 떡볶이가 있어 곤약 떡볶이 그거는 다른 음식이잖아요 아예 아니 그러니까 그 곤약 떡볶이 나쁘다는게 아니고 그냥 다른 음식이잖아 지금 떡볶이기 하고 있는데 순대국밥 얘기하는 거랑 똑같은 거죠 아예 다른 음식이야 그건 재료 떡볶이 제가 말해 놓고 아니 맛의 차이가 너무 크잖아 내가 말한 재료떡볶이는 맛이 딱 요건데 칼로리만 없어 코카콜라는 해냈잖아 콜라는 95%까지 따라왔잖아
197,6LwHV3whUQg,입안 점유율,너구리 라면 속 다시마와 육개장 사발면서 어묵입니다 다시마가 맛있고 존재감이 있는데 딱 하나야 근데 저 어묵은 중간중간에 계속 찾아 헤매면서 계속 먹어 준단 말이지 그러니까이 어떤 그 뭐라 그러지 축구에서 그 뭐라 그러지 볼 점유율 볼 점유율이라고 해야 되나 입안 점유율이 어묵이 훨씬 높아요 입안을 계속 주기적으로 점유를 해줘 발발 뛰면서 입안을 계속 발 밟아 뛰면서 근데 이제 다시마는 승부차기만 하는 녀석이야 다 먹고 나서 맛을 딱 마무리 짓는 녀석 이거는이 안에서 계속 주기적으로 어느 역할을 계속 가져가 주면서 입안을 점유를 해주는 느낌 저는 이거는 어묵이라고 봅니다
198,Jbk932n_Mzs,감사맨,이거는 원래 페페론치노라고 그 아기 고추 있죠 여러분 아기 고추 그거 이렇게 이렇게 부스트림 다음에 넣어야 되는데 하나가 한번 부상을 입었어요 제가 아 부상을 입었어요 6개월 감사합니다 고맙습니다 이거를 부신 다음에 아 힘들어 하면서 눈 한번 닦았다 자지러졌어 너무 아팠겠는데 [웃음] 그래가지고 위험하다 다 부서진 거를 팔더라고요 찬물로 눈 씻었죠 [음악] 병원도 안 가고 그냥 부상만 당하고 그냥 가만있으니까 나왔다 20개월 구독 감사합니다 고맙습니다
199,3_Ji1UQyGUI,어랍쇼?,그러니까 여러분들이 지금 일상생활에 너무 그냥 스쳐 지나가서인지 못하는게 있는데 세상에는 열 받을 일투성이에요 여러분들이 그냥 무심코 그냥 흘려보내서 그렇죠 열 받을 것 투성이야 진짜 나는 오늘도 열 받습니다 작정했구나 이거는 그렇지 이건 나 대놓고 나 대놓고 화내도 되는 거지 아니 애초에 작정했잖아 만들 때 그러니까 이거 본 사람 리액션 보고 싶어서 만든 거잖아 그치 각오한 거잖아 야 이거는
200,XKuuEEDguVU,잠들기 좋은 방송,"침착맨 님은 아무리 새벽에 공명전을 해도 1,500명이 거뜬하네요음 그 왜 그러신 줄 알아요 다른 게임을 하면은 더 줄어요 근데 공명전을 하면은 1,500명이 유지가 되죠 왜 그러겠어요 급속 냉각이라는 말 아세요 급속 냉각 급속 빠르게 어울리는 거죠 시청자를 빠르게 재워 가지고 못 나가게 하는 거예요 다른 게임을 많이 해보세요 키오스나 딴 거 해봐 그러면은 딴 거 볼래 나가는데 공명전을 해버리면은 급속도로 그냥 바로 드르렁 그러면은 못 나가는 거야 시청자가 그래서 하스스톤을 먼저 해서 사람들을 불러 모은 다음에 급속 냉각을 시켜 버리면 사람들이 그 자기가 어떤 일을 당하는지 모르는 상태에서 바로 들으러 그러면은요 시청자가 유지가 됩니다 공명전을 하기 때문에 1500명이 유지가 되는 거예요"
201,Sf_mk0hIAT4,떼창,내가 연인이 될 수 있을 리 없잖아 무리무리 그럼 여러분들 내가 여기까지 읽으면 여러분들 무리가 아니었다 이렇게 쳐줘야 줘 채팅창 으로 때까지 1 거면 자사 강입니다 내가 연인이 될 수 있을 리가 없잖아 루리 우리 제가 여기 취직해 보니 까지만 말할 테니까 여기 대우도 좋고 사장도 사용 마도 귀여워서 최고입니다 고치세요 젊은이들의 흑마 보기 피가 심각합니다 만 취직해 보니 아따 아 아 깍 깍
202,cMTcqWkaJx4,스토리 좀 하자,스토리 좀 어 거기 멋있다 이거 보고 갖다 놓자 집에 어떡하지 이거 붙여야 되는데 이거 붙일 수 있어요 너무 답답해
203,HMNqE8tSvCU,개성 VS 과함,아 돌게 써는 이런거 좀 그만 2부 아니 그 포인트도 많잖아 어떤 느낌이 잖아요 화 밥을 먹어 식당이 왔어 타 이렇게 먹어 그런데 이렇게 먹을 수도 있지 이렇게 먹을 수 있어 이건 개성이 야 음 이거 이렇게 먹고 이렇게 하고 이렇게 하시되 써 개성이 여기까지 근데 따야 다이어터 야이 다르게 쯤 되겠죠 그래서 아 아냐 먹어 맛있는데요 여기까지는 과하다는 거야 개성이 아니라는 거죠 어째서 뭐 그쪽 능숙한 산 입에 딱 얘기하다 한다 와 화장
204,bDSjMPDpRJM,보약 파워,"아 박성인 아 양파와 같은 상자 있네 빡 약 타오 아 story 2 시간을 두어 아로마 놀러가자 물로 은 타프 알고 있다 어떻게 뭘 떠올라요 하두 5,000원 19번 더 죽을 수 있어"
205,ip7Vxk2_SSc,에어컨의 요정,아 이렇게 쓰면 되겠습니다 그러면은 내가 이제 에어콘의 삶을 에어컨을 요정 이에요 처음에는 얘 내가 좀 주드로 맞아요 예 박차 연결관 진짜 해만 약탈 받아야 되냐 아니 두드려 맞으면서 사회성이 떨어져 악보 퍼갈때 아아 에어콘의 요정이 두드려 맞고 누구한테 어어어 내 2 들어야 맞은 상처 있어 어느 들어 바빠도 파김치가 7기 로 가요 때로 맞고 나니까 요기 동의 많은 투자자들이 좀 있어요 돈이 많으니까 같이 만나면서 돈을 아 풀어 아 돈 다 쓰고 나니까 돈이 없네 하천 오자 역으로 같이 뭐 섞여 0 아 돈을 다 뿌리고 나니까 애들이 많이 풀이 죽어 애들이 약간 나 되질 못해 쉬지 토닉 셀리아 알아요 그 정말 가져와 것 같은게 더 유정이의 해봤고 왜 돈을 다 뺏기는 부자들이 있어서 갑자기 사이가 좋아지고 아 이거 너무 어렵다 이거
206,hJV3N0pz-_A,숙련된 조교의 시범,신속하게 한번 해본 것이 속하죠 매끄러워 이거 다 숙련된 조교 가 없어 한번 해보 이건 그렇죠 아까 ri 그 아아아 있겠지 아 아 잠깐 팔짱 그래서 안이 살짝 링크 계십니까
207,5cNZztpJk84,비나방 이름 솔루션,시나 방 요거는 굳이 뭐 하자면 이름을 뭘 꼴아 식빵 새 얘는 뭘 꼴아 봐야겠어 얘 얘가 쳐다보는 야 이거 이날 개인데 누나에게 눈이 나 줬잖아 나를 보잖아 벌꿀 라벨 빵 3 예 예 여기에 맞지 않나 제가 봤을 땐 요렇게 쓸려 솔루션을 좀 드릴수 있을것 같고 내 들 게임의 뭘 꼴아 밥 빵 사 님 괜찮냐 그 이렇게 그렇죠 여기죠 여기서 오라방 세어 보라 강세 괜찮지 오방색 검고 방 3 나쁘지 않아요 원래 아이디어가 처음부터 좋을 순 없어 거기서 별론데 에서 주는 때문에 는 아이디어가 연결이 안되요
208,C1cWwBb2Sjc,째깍째깍,그래서 편하게 오브 어 뭐 아 5 기체 문 눌렀어요 그럼 파티 위한 야 영향 잘되고 들어왔는데 않죠 딱지 파기합니다 아냐아냐 한번 더 해 줘 아아앙 [박수] wot 리포팅 카카오톡 개발을 1일
209,_Sm4tUQ7Cbs,기억력 테스트,중국 당면을 넣고 일반 당면 넣고 팽이 느타리 익 12가지 밖에 안되는데 그러면은 백묵 2 를 뺏 개 아 갑자기 하고 싶은 말을 본인이 하고 싶은 말에 이렇게 그렇게 얘기를 뭐 충성 끝에는 충성 나 오늘 자 이렇게 해서 지금 많아 샹 0 아 아 아 다 취소돼 써 으 아마 1년 아주 오바 직제 타면 되지만 다시 하면 되지 그쵸 그런 기업용 좋잖아요 걸어갑니다
210,_ZBqufiKNdc,라라랜드 플래시 몹,[음악] 어떻게 여냐고 차를 타라고 아 이렇게 아 아 야 이거 빵 뚫렸다 빵 뚫렸다
211,AyNqYdXThRw,소사이어티 교육,쌍쌍바 아 이거 뜻이 잘 대단해요 진짜 혼자 먹어도 좋고 둘이 먹어도 좋고 그리고 국노 긴데 토끼 모양으로 게 되면은 요건은 얻어먹는 내가 먹는 거예요 뭐 당연한 거야 얻어먹는 이거 생각도 안에 애초에 아 이거 먹는거에 요것도 이제 갑을 관계의 교육도 있죠 제가 사주는 되니까 제가 응당 많이 먹지 뭐 나는 얻어 먹으니깐 요만큼만 먹자 소스 아이같이 교육 이렇게 받는 거죠 쌓여 지금 음 어 그래 돈이 짱 이구나
212,6EMNTdUOiw8,이거 뺏은 거로 치는 거예요?,아 수도 앞으로의 이때 내리지 내리지 어깨 진각 기록된다 4 그렇게 낫다 싶어 안되요 어떻게 하죠 5 차마 이 뺏은 거야 뭐야 예 배식을 치는 거야 뭐예요 어떻게 이거 으
213,-njYuT-IFHM,버근가?,야 자꾸 19 10 옛날 전통 프레임 빵 옛날 전통 크림빵 에 비해서 크림이 더 많이 들어갔어요 음 400 칼로리 아 400kcal 뻗었다 라면은 역할로 이들은 보통인데 뭐 웃기는 뭐다 다 모으는데 버금 과 일단 마저 크림빵을 마조 노사모
214,MjDbd7XsOYM,K-민트,4 올라가 있는 거야 본래 뭐야 돼 깬 입을 그렇네요 끊임이 싫어 표 2 민트 야 케 이벤트 뭐 깬 입 초코 하면 우리 k 콘텐츠 선도할수 있어요 지금은 또 막 것까지 1년 뒤에 뭐 침 천명 님 드디어 드디어 이런일도 있네요 민트 개님 이 드디어 나왔습니다 그러면서 댓글에 잊겠지 갖다 쓰는 것은 상관없는데 제발 말하고 써 지금은 지금은 비웃어 지금
215,G1Uat9g3MVg,요 맛이지,아 어떠한 g2 재미가 있네 아 아 아닙니다 으 뭐하시는 거예요 5 누구 하셔야 아 아 그럼 cover 턴 뜻이 아요 말 아 빵 빵 빵 빵 빵 빵 빵 빵 빵 빵 빵 뭐야 아사미 [음악] sc 5
216,4WH15L54AJ8,나는 애쉬,we 나는에 쉼 4 레 쉬 전주역 원이란 아내는 쉬 말에 내쉬 날 은 애쉬 1 나의 레 내 씩 헨리 비 아 요 인도하소서 3 msc nl 수 내내 4시 팽이 bi 키 술 밝히 소수 f 진짜 준비된 사수 쓰시고 해야 하는게 내 소식을 철 해주려고 전서 구야 발언 한테 안보 정책의 술래 자 전에 숙이님 아 아 또
217,p2rAu14SIL8,우유밥,필러델피아 오이치즈 그리고 우유밥 우유밥은 나쁘지 않다고들은 거 같은데 난 그렇게 들었어요 왜냐면 이게 크림 우유가 또 크림 뭐 이렇게 연결이 되어 있잖아 그래가지고 나쁘지 않다고 들었습니다 저지방 우유는 단맛 거의 없어서 은근 사골맛 나 그러겠네 왜냐면 사골이 뭐야 소 뼈잖아 소 몸에 있는 거잖아 우유가 뭐야 소 몸에 있었던 거잖아 젖이잖아 소똥도 먹냐고 자 우유밥 올리도록 하겠습니다
218,_OCBgZuV1zU,마방 떡볶이,마늘 떡볶이 부터 먹겠습니다 아 만일 맛이에요 놀라지 마세요 마늘 떡볶이 는 마늘 많습니다 건강이 좋아지는 듯한 느낌이 들어요 저항력이 올라가는 느낌이고 저항력이 올라간다는 말이 무슨 뜻이 마방 몰라요 더 학력이 올라간다고 말 그대로 나올 거 아냐 평균 들이 막 나한테 올 거 아냐 한데 마늘이 일시적으로 내마 밤을 올려 주는 거죠 착각에서 안되는게 일시적인 거야 영원히 막 아울러 주는거 아냐 꾸준히 먹어 줘야 되요 먹으면 한번 하러 갑니다 꾸준히 먹어줘야 울 바 올려지는 실제로는 칼슘 단백질 이런거를 먹어야죠 답 연금 공격하고 물리 공격력 각각 따로 담당 하는게 있기 때문에
219,IFZJVyzbPrE,색종이 슬리퍼,가봉 뜬 거 가방 뜬 건 아니지 아니 가죽만 살짝 얹어 놓은 거잖아 이게 뭐야 이거 불편해 그리고 이거 난 너무 열 받는게 이게 그 색종이를 쓰다 보면 이런 색종이가 나와요 여기 자르고 저기 자르고 그냥 눈에 보이는 대로 그냥 계획 없이 자르다가 통으로 아깝게 여기 다 못 쓰게 되는 색종이가 있어 기분이 썩 좋지가 않아 색종이에서 이런 건 애물단지거든 버리기 아까 왜냐면 이만큼 많이 남았으니까 그럼 어떻게 색종이 거기에다 다시 넣어 그럼 쓸데없이 계속 있단 말이야 그럼 또 끄네 그럼 어차피 쓸 것도 아니야 새 거를 또 잘라 그러니까 얘는 계속 넣었다 뺐다 넣었다 뺐다 계속 있다가 나중에 그냥 이사 가거나 할 때 버려진단 말이야 그거를 쓴 거 같아서 기분이 썩 좋지가 않아 그걸 심지어 그걸로 만들었을 수도 있어 근데 아닐 수도 있어 자 여기까지만 하겠습니다
220,yd9WXAFaaNs,반차맨의 반차 사유,이 반 차면 한참인 이라고 할게요 판 참 한테 1 잔뜩 시킬려고 아침에 부장님 쓴 나가지고 막 루랄라 1대 1 반 참여 및 끼워 느꼈다 오늘 너무 개 줘야지 해서 신나서 했는데 부장님 오늘 저는 지금 참외 방송을 봐야 되기 때문에 반찬 쓰겠습니다 그러면 부장님이 개불은 1 알게 어사 심으로 그러니까 여러분들이 반찬 했으면 누군가가 굉장히 시무룩해 진다는 것 만큼은 알아 주십사 하는 말씀 말씀을 드리는 겁니다 아셨죠 편자 쓰겠습니다
221,JmAzz-HFZWs,양심어디냉장고,브라운 물인데 가 얼굴이야 지금 바라보도록 봐봐 너 지금 나 범칙금 내 표가 안심 냉장고 타야 된다고 지독한 아 아 학생으로 앞에 어찌 베리 머치 치킨을 시켜 놓았는데 치는 7월 쫀쫀 오세요
222,vhqBcHTq3Mc,보쌈 스토리,이 거야 뭐 영 아니었어요 어휴 보르 에 거짓말입니다 와 사정 너무 조그만 사방 같이 하도록 알게 질서 말할 거야 신파치 맛있어도 할 때 그렇게 몇 개야 가서 때야 4개 더 보기 딴 털어 감나무 나더러 1 * 1 걸어간 에러가 썰어 써볼까 면접후 잠들었어 앰버 그럴 수 있지 뭐 차부터 50 내가 나같이 스타들도 없는 도예 강화도 있어서 빗소리 받잖아요 찾아올 소리 아 이거 뭐야 도 3 소리 요걸 좀 아 이거 아래 땋아 예 이걸 가르쳐 줬어 사람들이 lh 아니면 괜찮았지 이 아싸 or 왜 헤아릴수 몇장 아 좋아 아 나중에 불다 보호 아아 남 거야 이게 음식 나랑 닮아
223,umHBT9bxHAo,누가 보기 전에 얼른 내려와,여기로 올라갈까 오늘 올라가 그렇게 되는 안 되는 짓 을 마크가 있구나 다 아 1 p2p 야 이 let i [음악] 마디풀 서머스 바뀌어야 돼요 어때요 [박수] 아 저는 머리만 살짝 깊었는데 아
224,y_tSupwX4Pk,와 싸다!,"어는 양이 매우 들어가는 경우에는 산지가 게 대폭락 하는데요 키로에 3000원이 되던 적도 있습니다 여름의 태풍 까지 와 바닥 바닥을 다 뒤집어 줘 가지고 요 아래 싸움 번 올려줘서 수량이 더 드러났습니다 근데 실제로 소비자층이 할 때는 비싼 가격에 거래 됩니다 개의 브랜드 이미지로 비싼 가격이 내려 고정 되서 그 정도 가격에 돼야지 팔리기 때문에 너무 쌀 면은 어 옮겨갈 비싸지 왜 그러지 이런 느낌이 되나봐 그런거 있죠 확실히 마약의 여러분들 생각해봐요 찾아 입어 5,000원 어 근데 놀랍게도 그 해풍에 와가지고 막 팝 바닥을 막타 뒤 집에서 밥 산을 엄청나게 잡혔어 근데 5천원 이라고나 뻑 간 4g 근데 200만원 입니다 아 그 때에 비로소 와싸다 그래서 사실 와싸다 5개 주세요 일이지 근데 5천원 이름은 아"
225,mn-MPmYtG1U,꽉 묶인 비닐봉지 푸는 법,이거 꽉 묶인 비닐봉지 푸는 법 알려드릴게요 돌려 끝에 그렇게 딱해 지거든요 숨이 면제 2 및 없어 이 뿐이야 올려 8 8 이면 이게 깜짝 되죠 조수호 입니더 음 둡니다 근데 앉아 있을 때 단 대면하는 기자 확실히 졸리니까 태연이
226,fIkeeaCtduc,심착맨,관으로 만들까 아 관수로 없어 [음악] 고침 창 명의 되는데 아 아따 봤죠 [음악]
227,kONle5u3cDw,저 보세요,카페 한번 약사 벌써 보이고 양 한경대 가독성이 짜 좀 해봐서 어 어 아니 잘해야 스파 오는게 죄악 그러지 일단 버려도 갑니다 아니 수 없고 미치겠다고 진짜 뭔데 내가 & h 타미 접으세요 예 와 있어요 예 아 으 아 아 악 아 미치는 육수 놈이 신의 아 합니다 그래도 달 보라고 한다면 이걸 뭐 어종 수 i 이상한 사람이 있어 팀의 이상한 사람이 있어요
228,NnBiTBRrLv0,간단한 운동,집에서 요즘 하는 거 간단한 거 하나 알려드릴게요 그냥 밟아 뛰기 한번 해보세요 네 다섯 여섯 일곱 여덟 좋다 좋다 좋다 어이구 어쭈구리 물이 오 놀면서 이거는 고난도인데 같이 돌아 어 좋아 [음악] 좋아
229,6wa0LPZtMfE,심술님,박정민 배우님이라고 할까 왜 사람들이 왜 배우에만 왜 님을 붙이냐에 어색하게 근데 작가님 배우님 뭐 다 그렇게 하는 거 아니야 지갑에다 원래 님 부츠야 선생님 뭐 이렇게 근데 그 어색해 하는 거야 차돌짬뽕 님
230,Xy0AdGuqLRY,리액션 한번 해!,이성친구 만드는게 말 제일 빨리 는데 이 화면을 가려 가르쳐줘 가지고 일단은 싸워 싸울 따 오거든요 싸울 때 엄청 는데요 탁 자 가봐야 돼 얘기 한번 해줘야 대처 담합 시작하십시오 아 빠 안들었어요 까미 아예 뭐 한 번 해 드립시다 웹페이지 있잖아 아 해가 됩니다
231,sZawGhVSeRU,아가야...,아 아뇨 로 어른이 되면 속으로 울어야 많이 올려 봐야 베이비 라는 등
232,B5H_93KibVE,숙맥,저의 심정 아까처럼 해야 수명 되냐면 네 여자를 만나는게 됐습니다 그러니까 대학교 로 갔어요 표는 남자 드라곤 않나요 또 부담돼 얘기하는 것도 에너지 어서 뭐 그렇죠 이제 초 별과 절이라는 여자의 두며 붙여준 거야 으하하 옹 전략인데 군대 갔다와서 앱 팀이 되기 말이야 이제 너무 부담되는 거야 그래서 너무 쑥스럽고 어땠냐 학교다 가끔 다시 주 별로 안 쳤어 목가 따라와 줘서 이 정도로 쭉 내렸어 근데 개방 뻔 해 줬어
233,HEJi7BnBrh8,택배사기,인생은 실전이다 좋은 경험 했다고 생각하세요 주신 돈은 좋은데 쓰겠습니다 냠냠 그럴거 은 농담 만화책은 제품 지지용 입니다 회장 쓰레기가 많아서 최소 이마 쌀 아 이거구나 내고 10 9 이제 우리 살아가는 사람들도 느껴지는게 이 만큼의 다 넣었어 신문지를 잠든 넣어가지고
234,20iGV0LHP50,아들천재 불쇼,이제 파프리카를 굽는 걸 봤거든요 이렇게 할 필요가 없어 그냥 올려놔 이렇게 아 그렇담 으 아 이게 더 빨라 같구요 아 그쵸 이렇게 왜 없어 향기 시킬려고 2 졸 갑절 아 좀 5 나 무조건 얼굴부터 않아 오줌 싸는 거 아냐 오늘 밤에 오줌 아 싼다 아 5 선율이 하고 자야겠다 우선 우리한테 뒤집어 씌우기 되야 되지 내가 쓰고
